{"capturedAt":"2026-07-31T18:01:00Z","currentManifestSha256":"sha256:bbbbbbbbbbbbbbbbbbbbbbbbbbbbbbbbbbbbbbbbbbbbbbbbbbbbbbbbbbbbbbbb","currentRelease":"v1.2.2","installedStateSha256":"sha256:aaaaaaaaaaaaaaaaaaaaaaaaaaaaaaaaaaaaaaaaaaaaaaaaaaaaaaaaaaaaaaaa","kind":"production-snapshot","mode":"UPDATE","operationId":"deployment_0123456789abcdef","schemaVersion":1,"targetRelease":"v1.2.3"}
